{
  "version": "1.0.0",
  "updated_at": "2026-04-05",
  "source_note": "Starter keyword graph with depth 0-3.",
  "nodes": [
    {
      "id": "unclear_direction",
      "label": "Mơ hồ hướng đi",
      "depth": 0,
      "kind": "feeling",
      "parent_ids": [],
      "child_ids": [
        "ud_future",
        "ud_strengths",
        "ud_roadmap"
      ],
      "related_node_ids": [
        "stuck"
      ],
      "life_area_weights": {
        "direction": 0.6,
        "career": 0.4
      },
      "persona_tags": [
        "all"
      ],
      "clarifying_prompts": [
        "Điều nào mơ hồ nhất: tương lai, năng lực, hay lộ trình?"
      ],
      "short_meaning": "Mơ hồ hướng đi",
      "long_meaning": "Node 'Mơ hồ hướng đi' dùng để nhận diện một lớp vấn đề trong flow coaching.",
      "reflection_prompts": [
        "Điều nào mơ hồ nhất: tương lai, năng lực, hay lộ trình?"
      ],
      "ai_hints": [],
      "audit_tags": [],
      "status": "active",
      "version": "v1"
    },
    {
      "id": "ud_future",
      "label": "Không thấy tương lai",
      "depth": 1,
      "kind": "problem",
      "parent_ids": [
        "unclear_direction"
      ],
      "child_ids": [
        "ud_future_path",
        "ud_future_industry"
      ],
      "related_node_ids": [
        "pressure_expectation",
        "stuck_growth"
      ],
      "life_area_weights": {
        "direction": 0.5,
        "career": 0.5
      },
      "persona_tags": [
        "early-career",
        "transition"
      ],
      "clarifying_prompts": [
        "Anh/chị không thấy tương lai ở công việc hiện tại hay ở cả bản thân?"
      ],
      "short_meaning": "Không thấy tương lai",
      "long_meaning": "Node 'Không thấy tương lai' dùng để nhận diện một lớp vấn đề trong flow coaching.",
      "reflection_prompts": [
        "Anh/chị không thấy tương lai ở công việc hiện tại hay ở cả bản thân?"
      ],
      "ai_hints": [],
      "audit_tags": [],
      "status": "active",
      "version": "v1"
    },
    {
      "id": "ud_strengths",
      "label": "Không rõ mình mạnh gì",
      "depth": 1,
      "kind": "problem",
      "parent_ids": [
        "unclear_direction"
      ],
      "child_ids": [
        "ud_strengths_feedback",
        "ud_strengths_exposure"
      ],
      "related_node_ids": [
        "stuck_motivation",
        "want_change_job"
      ],
      "life_area_weights": {
        "capability": 0.5,
        "direction": 0.5
      },
      "persona_tags": [
        "all"
      ],
      "clarifying_prompts": [
        "Vấn đề là chưa từng thử đủ nhiều, hay chưa từng được phản hồi đúng?"
      ],
      "short_meaning": "Không rõ mình mạnh gì",
      "long_meaning": "Node 'Không rõ mình mạnh gì' dùng để nhận diện một lớp vấn đề trong flow coaching.",
      "reflection_prompts": [
        "Vấn đề là chưa từng thử đủ nhiều, hay chưa từng được phản hồi đúng?"
      ],
      "ai_hints": [],
      "audit_tags": [],
      "status": "active",
      "version": "v1"
    },
    {
      "id": "ud_roadmap",
      "label": "Không có roadmap",
      "depth": 1,
      "kind": "problem",
      "parent_ids": [
        "unclear_direction"
      ],
      "child_ids": [
        "ud_roadmap_mentors",
        "ud_roadmap_decision"
      ],
      "related_node_ids": [
        "want_change",
        "want_change_reset"
      ],
      "life_area_weights": {
        "direction": 0.4,
        "life_system": 0.3,
        "career": 0.3
      },
      "persona_tags": [
        "all"
      ],
      "clarifying_prompts": [
        "Thiếu roadmap vì thiếu mentor, thiếu dữ liệu, hay thiếu kỷ luật?"
      ],
      "short_meaning": "Không có roadmap",
      "long_meaning": "Node 'Không có roadmap' dùng để nhận diện một lớp vấn đề trong flow coaching.",
      "reflection_prompts": [
        "Thiếu roadmap vì thiếu mentor, thiếu dữ liệu, hay thiếu kỷ luật?"
      ],
      "ai_hints": [],
      "audit_tags": [],
      "status": "active",
      "version": "v1"
    },
    {
      "id": "pressure",
      "label": "Áp lực",
      "depth": 0,
      "kind": "feeling",
      "parent_ids": [],
      "child_ids": [
        "pressure_money",
        "pressure_expectation",
        "pressure_roles"
      ],
      "related_node_ids": [
        "stuck",
        "want_change"
      ],
      "life_area_weights": {
        "inner_system": 0.4,
        "finance": 0.3,
        "environment": 0.3
      },
      "persona_tags": [
        "all"
      ],
      "clarifying_prompts": [
        "Áp lực này đến từ tiền, kỳ vọng, hay gánh nhiều vai?"
      ],
      "short_meaning": "Áp lực",
      "long_meaning": "Node 'Áp lực' dùng để nhận diện một lớp vấn đề trong flow coaching.",
      "reflection_prompts": [
        "Áp lực này đến từ tiền, kỳ vọng, hay gánh nhiều vai?"
      ],
      "ai_hints": [],
      "audit_tags": [],
      "status": "active",
      "version": "v1"
    },
    {
      "id": "pressure_money",
      "label": "Áp lực tài chính",
      "depth": 1,
      "kind": "problem",
      "parent_ids": [
        "pressure"
      ],
      "child_ids": [
        "pressure_money_income",
        "pressure_money_buffer"
      ],
      "related_node_ids": [
        "want_change",
        "want_change_business_risk",
        "want_change_job"
      ],
      "life_area_weights": {
        "finance": 0.7,
        "career": 0.3
      },
      "persona_tags": [
        "male",
        "builder",
        "mid-career"
      ],
      "clarifying_prompts": [
        "Áp lực chính là thu nhập thấp, dòng tiền bấp bênh, hay không có vùng đệm?"
      ],
      "short_meaning": "Áp lực tài chính",
      "long_meaning": "Node 'Áp lực tài chính' dùng để nhận diện một lớp vấn đề trong flow coaching.",
      "reflection_prompts": [
        "Áp lực chính là thu nhập thấp, dòng tiền bấp bênh, hay không có vùng đệm?"
      ],
      "ai_hints": [],
      "audit_tags": [],
      "status": "active",
      "version": "v1"
    },
    {
      "id": "pressure_expectation",
      "label": "Áp lực kỳ vọng",
      "depth": 1,
      "kind": "problem",
      "parent_ids": [
        "pressure"
      ],
      "child_ids": [
        "pressure_expectation_family",
        "pressure_expectation_self"
      ],
      "related_node_ids": [
        "ud_future"
      ],
      "life_area_weights": {
        "environment": 0.4,
        "inner_system": 0.6
      },
      "persona_tags": [
        "all"
      ],
      "clarifying_prompts": [
        "Kỳ vọng này đến từ gia đình, môi trường, hay chính bản thân?"
      ],
      "short_meaning": "Áp lực kỳ vọng",
      "long_meaning": "Node 'Áp lực kỳ vọng' dùng để nhận diện một lớp vấn đề trong flow coaching.",
      "reflection_prompts": [
        "Kỳ vọng này đến từ gia đình, môi trường, hay chính bản thân?"
      ],
      "ai_hints": [],
      "audit_tags": [],
      "status": "active",
      "version": "v1"
    },
    {
      "id": "pressure_roles",
      "label": "Quá nhiều vai trò",
      "depth": 1,
      "kind": "problem",
      "parent_ids": [
        "pressure"
      ],
      "child_ids": [
        "pressure_roles_family",
        "pressure_roles_focus"
      ],
      "related_node_ids": [
        "pressure_roles_family"
      ],
      "life_area_weights": {
        "life_system": 0.4,
        "environment": 0.3,
        "health": 0.3
      },
      "persona_tags": [
        "builder",
        "female"
      ],
      "clarifying_prompts": [
        "Vai trò nào đang lấy nhiều năng lượng nhất?"
      ],
      "short_meaning": "Quá nhiều vai trò",
      "long_meaning": "Node 'Quá nhiều vai trò' dùng để nhận diện một lớp vấn đề trong flow coaching.",
      "reflection_prompts": [
        "Vai trò nào đang lấy nhiều năng lượng nhất?"
      ],
      "ai_hints": [],
      "audit_tags": [],
      "status": "active",
      "version": "v1"
    },
    {
      "id": "stuck",
      "label": "Bị kẹt",
      "depth": 0,
      "kind": "feeling",
      "parent_ids": [],
      "child_ids": [
        "stuck_growth",
        "stuck_motivation",
        "stuck_environment"
      ],
      "related_node_ids": [
        "pressure",
        "unclear_direction"
      ],
      "life_area_weights": {
        "career": 0.4,
        "inner_system": 0.3,
        "environment": 0.3
      },
      "persona_tags": [
        "all"
      ],
      "clarifying_prompts": [
        "Sự kẹt này là do tăng trưởng, động lực, hay môi trường?"
      ],
      "short_meaning": "Bị kẹt",
      "long_meaning": "Node 'Bị kẹt' dùng để nhận diện một lớp vấn đề trong flow coaching.",
      "reflection_prompts": [
        "Sự kẹt này là do tăng trưởng, động lực, hay môi trường?"
      ],
      "ai_hints": [],
      "audit_tags": [],
      "status": "active",
      "version": "v1"
    },
    {
      "id": "stuck_growth",
      "label": "Làm lâu nhưng không tiến",
      "depth": 1,
      "kind": "problem",
      "parent_ids": [
        "stuck"
      ],
      "child_ids": [
        "stuck_growth_skill",
        "stuck_growth_visibility"
      ],
      "related_node_ids": [
        "ud_future"
      ],
      "life_area_weights": {
        "career": 0.6,
        "capability": 0.4
      },
      "persona_tags": [
        "early",
        "mid"
      ],
      "clarifying_prompts": [
        "Không tiến vì skill không tăng, hay vì không được nhìn thấy?"
      ],
      "short_meaning": "Làm lâu nhưng không tiến",
      "long_meaning": "Node 'Làm lâu nhưng không tiến' dùng để nhận diện một lớp vấn đề trong flow coaching.",
      "reflection_prompts": [
        "Không tiến vì skill không tăng, hay vì không được nhìn thấy?"
      ],
      "ai_hints": [],
      "audit_tags": [],
      "status": "active",
      "version": "v1"
    },
    {
      "id": "stuck_motivation",
      "label": "Thiếu động lực",
      "depth": 1,
      "kind": "problem",
      "parent_ids": [
        "stuck"
      ],
      "child_ids": [
        "stuck_motivation_meaning",
        "stuck_motivation_energy"
      ],
      "related_node_ids": [
        "ud_strengths"